director_name,actor_1_name,actor_2_name,actor_3_name,genres,movie_title,comb
Muddassar Aziz,Fardeen Khan,Ishita Sharma,Sushmita Sen,Romantic comedy,dulha mil gaya,Fardeen Khan Ishita Sharma Sushmita Sen Muddassar Aziz Romantic comedy
Jugal Hansraj,Priyanka Chopra,Uday Chopra,Anupam Kher,Romantic comedy,pyaar impossible!,Priyanka Chopra Uday Chopra Anupam Kher Jugal Hansraj Romantic comedy
Ken Ghosh,Shahid Kapoor,Genelia D'Souza,unknown,"Romance, Dance",chance pe dance,"Shahid Kapoor Genelia D'Souza unknown Ken Ghosh Romance, Dance"
Dileep Shukla,Rajpal Yadav,Preeti Mehra,unknown,Comedy,hello! hum lallan bol rahe hain,Rajpal Yadav Preeti Mehra unknown Dileep Shukla Comedy
Anil Sharma,Salman Khan,Zarine Khan,Mithun Chakraborty,Epic film,veer,Salman Khan Zarine Khan Mithun Chakraborty Anil Sharma Epic film
Abhishek Chaubey,Naseeruddin Shah,Vidya Balan,Arshad Warsi,"Black comedy, Romance",ishqiya,"Naseeruddin Shah Vidya Balan Arshad Warsi Abhishek Chaubey Black comedy, Romance"
Ram Gopal Varma,Amitabh Bachchan,Sudeep,Ritesh Deshmukh,"Drama, Thriller",rann,"Amitabh Bachchan Sudeep Ritesh Deshmukh Ram Gopal Varma Drama, Thriller"
Amit Rai,Paresh Rawal,Om Puri,Javed Sheikh,Drama,road to sangam,Paresh Rawal Om Puri Javed Sheikh Amit Rai Drama
Vishal Bhandari,Om Puri,Shreyas Talpade,Gulshan Grover,Drama,the hangman,Om Puri Shreyas Talpade Gulshan Grover Vishal Bhandari Drama
Chandan Arora,Siddharth Narayan,Aditya Pancholi,Ankur Vikal,Action,striker,Siddharth Narayan Aditya Pancholi Ankur Vikal Chandan Arora Action
Manjeet Mann,Gurdas Maan,Juhi Chawla,Divya Dutta,Drama,sukhmani: hope for life,Gurdas Maan Juhi Chawla Divya Dutta Manjeet Mann Drama
Deepak Bandhu,Anant Jog,Nagesh Bhonsle,Mushtaq Khan,Action,aakhari decision,Anant Jog Nagesh Bhonsle Mushtaq Khan Deepak Bandhu Action
Sangeeth Sivan,Shreyas Talpade,Sadha,Sneha Ullal,Horror,click,Shreyas Talpade Sadha Sneha Ullal Sangeeth Sivan Horror
Kedarh Shinde,Tabu,Sharman Joshi,Vatsal Sheth,Romantic comedy,toh baat pakki!,Tabu Sharman Joshi Vatsal Sheth Kedarh Shinde Romantic comedy
Vijay Lalwani,Farhan Akhtar,Deepika Padukone,Ram Kapoor,Thriller,karthik calling karthik,Farhan Akhtar Deepika Padukone Ram Kapoor Vijay Lalwani Thriller
Leena Yadav,Amitabh Bachchan,Ben Kingsley,R. Madhavan,"Drama, Thriller",teen patti,"Amitabh Bachchan Ben Kingsley R. Madhavan Leena Yadav Drama, Thriller"
Ashwni Dhir,Ajay Devgn,Konkona Sen Sharma,Paresh Rawal,Comedy,atithi tum kab jaoge?,Ajay Devgn Konkona Sen Sharma Paresh Rawal Ashwni Dhir Comedy
Raja Unnithan,Mrunmayee Lagoo,Milind Gunaji,Neena Gupta,Drama,hello zindagi,Mrunmayee Lagoo Milind Gunaji Neena Gupta Raja Unnithan Drama
Dev Benegal,Abhay Deol,Satish Kaushik,Tannishtha Chatterjee,Drama,"road, movie",Abhay Deol Satish Kaushik Tannishtha Chatterjee Dev Benegal Drama
Rajesh Ranshinge,Udita Goswami,Shaad Randhawa,Nishigandha Wad,Thriller,rokkk,Udita Goswami Shaad Randhawa Nishigandha Wad Rajesh Ranshinge Thriller
Irfan Kamal,Alok Nath,Raghuveer Yadav,Barry John,Drama,thanks maa,Alok Nath Raghuveer Yadav Barry John Irfan Kamal Drama
Akash Pandey,Rajesh Khanna,Nausheen Ali Sardar,Sonika Gill,Romantic comedy,do dilon ke khel mein,Rajesh Khanna Nausheen Ali Sardar Sonika Gill Akash Pandey Romantic comedy
Shawn Arranha,Purab Kohli,Arjan Bajwa,Mrinalini Sharma,Thriller,hide & seek,Purab Kohli Arjan Bajwa Mrinalini Sharma Shawn Arranha Thriller
Rahul Aggarwal,Rahul Aggarwal,Paresh Rawal,Narayani Shastri,Comedy,na ghar ke na ghaat ke,Rahul Aggarwal Paresh Rawal Narayani Shastri Rahul Aggarwal Comedy
Neeraj Pathak,Sunny Deol,Irrfan Khan,Isha Koppikar,Action,right yaaa wrong,Sunny Deol Irrfan Khan Isha Koppikar Neeraj Pathak Action
Arshad Khan,Vikrum Kumar,Urvashi Chowdhary,Mansi Dovhal,"Action, Thriller",trump card,"Vikrum Kumar Urvashi Chowdhary Mansi Dovhal Arshad Khan Action, Thriller"
Sunanda Mitra,Sushant Singh,Hrishita Bhatt,Jyoti Gauba,Drama,idiot box,Sushant Singh Hrishita Bhatt Jyoti Gauba Sunanda Mitra Drama
Sanjay Puran Singh Chauhan,Aanaahad,Shraddha Das,Farooq Sheikh,Sports/Social,lahore,Aanaahad Shraddha Das Farooq Sheikh Sanjay Puran Singh Chauhan Sports/Social
Dibakar Banerjee,Amit Sial,Anshuman Jha,Arya Banerjee,Found footage,love sex aur dhokha,Amit Sial Anshuman Jha Arya Banerjee Dibakar Banerjee Found footage
Vikram Bhatt,Aditya Narayan,Shweta Agarwal,Rahul Dev,Horror,shaapit,Aditya Narayan Shweta Agarwal Rahul Dev Vikram Bhatt Horror
Kabeer Kaushik,Dia Mirza,Sandhya Mridul,Boman Irani,Comedy,hum tum aur ghost,Dia Mirza Sandhya Mridul Boman Irani Kabeer Kaushik Comedy
Saurabh Sengupta,Mohsin Akhtar,Mouli Ganguly,Ranjeet Jha,Social,it's a man's world,Mohsin Akhtar Mouli Ganguly Ranjeet Jha Saurabh Sengupta Social
Karan Razdan,Rituparna Sengupta,Rohit Roy,Gulshan Grover,Romance,mittal v/s mittal,Rituparna Sengupta Rohit Roy Gulshan Grover Karan Razdan Romance
Rajiv S. Ruia,Rahul Pendkalkar,Baba Sehgal,Eva Grover,Animation,my friend ganesha 3,Rahul Pendkalkar Baba Sehgal Eva Grover Rajiv S. Ruia Animation
Ashok Kheny,Arbaaz Khan,Tara Sharma,Madhuri Bhattacharya,Comedy,prem kaa game,Arbaaz Khan Tara Sharma Madhuri Bhattacharya Ashok Kheny Comedy
Shyam Benegal,Boman Irani,Minissha Lamba,Sameer Dattani,Social,well done abba,Boman Irani Minissha Lamba Sameer Dattani Shyam Benegal Social
Sudipto Chattopadhyaya,Bipasha Basu,Maradona Rebello,Mahesh Manjrekar,Social,pankh,Bipasha Basu Maradona Rebello Mahesh Manjrekar Sudipto Chattopadhyaya Social
Raj Kanwar,Luv Sinha,Ferena Wazeir,Rekha,Romance,sadiyaan,Luv Sinha Ferena Wazeir Rekha Raj Kanwar Romance
Kabir Sadanand,Nana Patekar,Dimple Kapadia,Rehan Khan,Social/Drama,tum milo toh sahi,Nana Patekar Dimple Kapadia Rehan Khan Kabir Sadanand Social/Drama
Milap Zaveri,Riteish Deshmukh,Jacqueline Fernandez,unknown,Comedy/Romance/Fantasy,jaane kahan se aayi hai,Riteish Deshmukh Jacqueline Fernandez unknown Milap Zaveri Comedy/Romance/Fantasy
Kookie Gulati,Vivek Oberoi,Neeru Bajwa,Nandana Sen,Action/Sci-Fi/Thriller,prince,Vivek Oberoi Neeru Bajwa Nandana Sen Kookie Gulati Action/Sci-Fi/Thriller
Aparna Sen,Rahul Bose,Raima Sen,Chigasu Takaku,Romance,the japanese wife,Rahul Bose Raima Sen Chigasu Takaku Aparna Sen Romance
Milind Ukey,Shahid Kapoor,Nana Patekar,Ayesha Takia,Social,paathshaala,Shahid Kapoor Nana Patekar Ayesha Takia Milind Ukey Social
Milind Gadagkar,Sudeep,Neeru Bajwa,Amruta Khanvilkar,Horror,phoonk 2,Sudeep Neeru Bajwa Amruta Khanvilkar Milind Gadagkar Horror
Jagmohan Mundhra,Rohit Roy,Tanushree Dutta,Neetu Chandra,Thriller,apartment,Rohit Roy Tanushree Dutta Neetu Chandra Jagmohan Mundhra Thriller
Mahesh Manjrekar,Vineet Kumar,Sameer Dharmadhikari,Kashmira Shah,Social,city of gold,Vineet Kumar Sameer Dharmadhikari Kashmira Shah Mahesh Manjrekar Social
Som Shekar,Gashmeer Mahajani,Twinkle Patel,Sunil Sabarwal,Romantic Comedy,muskurake dekh zara,Gashmeer Mahajani Twinkle Patel Sunil Sabarwal Som Shekar Romantic Comedy
Jagmohan Mundhra,Udita Goswami,Caterina Murino,Rajesh Khattar,Action,chase,Udita Goswami Caterina Murino Rajesh Khattar Jagmohan Mundhra Action
Sajid Khan,Akshay Kumar,Arjun Rampal,Deepika Padukone,Comedy,housefull,Akshay Kumar Arjun Rampal Deepika Padukone Sajid Khan Comedy
Parmeet Sethi,Shahid Kapoor,Anushka Sharma,Meiyang Chang,Romance/Drama,badmaash company,Shahid Kapoor Anushka Sharma Meiyang Chang Parmeet Sethi Romance/Drama
Priyadarshan,Darsheel Safary,Atul Kulkarni,Rituparna Sengupta,Children/Drama,bumm bumm bole,Darsheel Safary Atul Kulkarni Rituparna Sengupta Priyadarshan Children/Drama
K.D. Satyam,Anupam Kher,Aashish Vidyarthi,Ankur Khanna,Drama,admissions open,Anupam Kher Aashish Vidyarthi Ankur Khanna K.D. Satyam Drama
T K Rajeev Kumar,Rajpal Yadav,Khali,Nargis,Comedy/Romance,kushti,Rajpal Yadav Khali Nargis T K Rajeev Kumar Comedy/Romance
Anurag Basu,Hrithik Roshan,Kangana Ranaut,Bárbara Mori,Thriller/Romance,kites,Hrithik Roshan Kangana Ranaut Bárbara Mori Anurag Basu Thriller/Romance
Prakash Jha,Ajay Devgn,Ranbir Kapoor,Arjun Rampal,Drama/Political Thriller,raajneeti,Ajay Devgn Ranbir Kapoor Arjun Rampal Prakash Jha Drama/Political Thriller
Partho Ghosh,Jackie Shroff,Manisha Koirala,Aman Verma,Thriller,ek second... jo zindagi badal de?,Jackie Shroff Manisha Koirala Aman Verma Partho Ghosh Thriller
Mani Ratnam,Vikram Kennedy,Abhishek Bachchan,Aishwarya Rai Bachchan,Action/Romance,raavan,Vikram Kennedy Abhishek Bachchan Aishwarya Rai Bachchan Mani Ratnam Action/Romance
Mehul Kumar,Jahan Bloch,Sameer Aftab,unknown,Action,krantiveer - the revolution,Jahan Bloch Sameer Aftab unknown Mehul Kumar Action
Pravesh Raman,Aruna Shields,Prashant Narayanan,unknown,Drama,mr. singh mrs. mehta,Aruna Shields Prashant Narayanan unknown Pravesh Raman Drama
Punit Malhotra,Imran Khan,Sonam Kapoor,Sameer Dattani,Romance,i hate luv storys,Imran Khan Sonam Kapoor Sameer Dattani Punit Malhotra Romance
Satish Kaushik,Kareena Kapoor,Shahid Kapoor,Aarti Chabria,Romance,milenge milenge,Kareena Kapoor Shahid Kapoor Aarti Chabria Satish Kaushik Romance
Anant Mahadevan,Sunil Shetty,Vinod Khanna,Naseeruddin Shah,Action,red alert: the war within,Sunil Shetty Vinod Khanna Naseeruddin Shah Anant Mahadevan Action
Rahul Dholakia,Sanjay Dutt,Bipasha Basu,Kunal Kapoor,Action,lamhaa,Sanjay Dutt Bipasha Basu Kunal Kapoor Rahul Dholakia Action
Abhishek Sharma,Ali Zafar,Barry John,Nikhil Ratnaparkhi,Comedy,tere bin laden,Ali Zafar Barry John Nikhil Ratnaparkhi Abhishek Sharma Comedy
Vikramaditya Motwane,Ronit Roy,Rajat Barmecha,unknown,Drama,udaan,Ronit Roy Rajat Barmecha unknown Vikramaditya Motwane Drama
Priyadarshan,Akshay Kumar,Trisha Krishnan,Rajpal Yadav,"Comedy, Drama, Romance",khatta meetha,"Akshay Kumar Trisha Krishnan Rajpal Yadav Priyadarshan Comedy, Drama, Romance"
Milan Luthria,Ajay Devgn,Emraan Hashmi,Kangana Ranaut,"Action, Romance, Thriller, Crime",once upon a time in mumbaai,"Ajay Devgn Emraan Hashmi Kangana Ranaut Milan Luthria Action, Romance, Thriller, Crime"
Rajshree Ojha,Sonam Kapoor,Abhay Deol,Anand Tiwari,"Romance, Comedy",aisha,"Sonam Kapoor Abhay Deol Anand Tiwari Rajshree Ojha Romance, Comedy"
Rajeev Virani,Bobby Deol,Mugdha Godse,Sophia Handa,Horror,help,Bobby Deol Mugdha Godse Sophia Handa Rajeev Virani Horror
Anusha Rizvi,Omkar Das Manikpuri,Raghubir Yadav,unknown,"Political, Comedy",peepli live,"Omkar Das Manikpuri Raghubir Yadav unknown Anusha Rizvi Political, Comedy"
Pradeep Sarkar,Neil Nitin Mukesh,Deepika Padukone,unknown,Romance,lafangey parindey,Neil Nitin Mukesh Deepika Padukone unknown Pradeep Sarkar Romance
Amol Palekar,Antara Mali,Rajat Kapoor,Rituparna Sengupta,Drama,...and once again,Antara Mali Rajat Kapoor Rituparna Sengupta Amol Palekar Drama
Manoj Tiwari,Celina Jaitly,Isha Koppikar,Gul Panag,Comedy,hello darling,Celina Jaitly Isha Koppikar Gul Panag Manoj Tiwari Comedy
Sushil Rajpal,Raja Chaudhary,Vinay Pathak,unknown,Crime,antardwand,Raja Chaudhary Vinay Pathak unknown Sushil Rajpal Crime
Nagesh Kukunoor,John Abraham,Sonal Sehgal,Prateeksha Lonkar,Drama,aashayein,John Abraham Sonal Sehgal Prateeksha Lonkar Nagesh Kukunoor Drama
Sartaj Singh Pannu,Sartaj Singh Pannu,Barkha Madan,Bhupinder Singh,"Mystery, Suspense",soch lo,"Sartaj Singh Pannu Barkha Madan Bhupinder Singh Sartaj Singh Pannu Mystery, Suspense"
Siddharth Malhotra,Arjun Rampal,Kajol,Kareena Kapoor,"Drama, Romance",we are family,"Arjun Rampal Kajol Kareena Kapoor Siddharth Malhotra Drama, Romance"
Wilson Louis,Sameer Dattani,Sheena Nayar,Himanshu Malik,Horror,mallika,Sameer Dattani Sheena Nayar Himanshu Malik Wilson Louis Horror
Akshay Shere,Mohit Alawat,Kalki Koechlin,Vinay Pathak,Drama,the film emotional atyachar,Mohit Alawat Kalki Koechlin Vinay Pathak Akshay Shere Drama
Abhinav Kashyap,Salman Khan,Arbaaz Khan,Sonakshi Sinha,Action,dabangg,Salman Khan Arbaaz Khan Sonakshi Sinha Abhinav Kashyap Action
Rahsaan Islam,Rahsaan Islam,Bakhtiar Hafeez,Trishna Murad,Comedy,kings of devon,Rahsaan Islam Bakhtiar Hafeez Trishna Murad Rahsaan Islam Comedy
Raj Kumar Gupta,Rani Mukherjee,Vidya Balan,unknown,Social thriller,no one killed jessica,Rani Mukherjee Vidya Balan unknown Raj Kumar Gupta Social thriller
Rahat Kazmi,Vivek Sudershan,Sayali Bhagat,unknown,Adult/Comedy/Romance,impatient vivek,Vivek Sudershan Sayali Bhagat unknown Rahat Kazmi Adult/Comedy/Romance
Samir Karnik,Dharmendra,Sunny Deol,Bobby Deol,Comedy/Drama/Action,yamla pagla deewana,Dharmendra Sunny Deol Bobby Deol Samir Karnik Comedy/Drama/Action
Alankrita Shrivastava,Purab Kohli,Gul Panag,unknown,Adult/Romance/Comedy,turning 30!!!,Purab Kohli Gul Panag unknown Alankrita Shrivastava Adult/Romance/Comedy
Aman Mihani,Shilpa Shukla,Mohsin Akhtar,unknown,Comedy/Comedy/Comedy,mumbai mast kallander,Shilpa Shukla Mohsin Akhtar unknown Aman Mihani Comedy/Comedy/Comedy
Sagar Ambre Nikunj Pathak,Diksha Tomar,unknown,unknown,Social,odyssey of persistence,Diksha Tomar unknown unknown Sagar Ambre Nikunj Pathak Social
Kiran Rao,Prateik Babbar,Aamir Khan,Monica Dogra,Drama,dhobi ghat,Prateik Babbar Aamir Khan Monica Dogra Kiran Rao Drama
Manish Gupta,Vatsal Sheth,Tulip Joshi,Mukesh Tiwari,Social,hostel,Vatsal Sheth Tulip Joshi Mukesh Tiwari Manish Gupta Social
Madhur Bhandarkar,Ajay Devgn,Emraan Hashmi,Om Puri,Comedy,dil toh baccha hai ji,Ajay Devgn Emraan Hashmi Om Puri Madhur Bhandarkar Comedy
Sudhir Mishra,Arunoday Singh,Chitrangada Singh,Irrfan Khan,Cult,yeh saali zindagi,Arunoday Singh Chitrangada Singh Irrfan Khan Sudhir Mishra Cult
Vishal Aryan Singh,Parvathy Omanakuttan,unknown,unknown,Action/Thriller,united six,Parvathy Omanakuttan unknown unknown Vishal Aryan Singh Action/Thriller
Srikanth V. Velagaleti,Vinay Pathak,Mahie Gill,Mona Singh,Comedy,utt pataang,Vinay Pathak Mahie Gill Mona Singh Srikanth V. Velagaleti Comedy
Ganesh Acharya,Nilesh Sahay,Madalasa Sharma,Aruna Irani,Drama,angel,Nilesh Sahay Madalasa Sharma Aruna Irani Ganesh Acharya Drama
Nikhil Advani,Rishi Kapoor,Dimple Kapadia,Akshay Kumar,Family drama,patiala house,Rishi Kapoor Dimple Kapadia Akshay Kumar Nikhil Advani Family drama
Shankhadeep,Ishaan Manhaas,Ankita Shrivastava,unknown,Romance,aashiqui.in,Ishaan Manhaas Ankita Shrivastava unknown Shankhadeep Romance
Vishal Bhardwaj,Priyanka Chopra,Neil Nitin Mukesh,Naseeruddin Shah,Thriller/Black comedy,7 khoon maaf,Priyanka Chopra Neil Nitin Mukesh Naseeruddin Shah Vishal Bhardwaj Thriller/Black comedy
Sagar Ballary,Vinay Pathak,Sarika,Rukhsar,Children,kaccha limbo,Vinay Pathak Sarika Rukhsar Sagar Ballary Children
Vikram Pradhan,Rajpal Yadav,Johnny Lever,Divya Dutta,Comedy,masti express,Rajpal Yadav Johnny Lever Divya Dutta Vikram Pradhan Comedy
Anand Rai,Madhavan,Kangana Ranaut,Jimmy Sheirgill,Romance/Drama,tanu weds manu,Madhavan Kangana Ranaut Jimmy Sheirgill Anand Rai Romance/Drama
Vineet Khetrapal,Jackie Shroff,Kay Kay Menon,Rupali Ganguly,Family,satrangee parachute,Jackie Shroff Kay Kay Menon Rupali Ganguly Vineet Khetrapal Family
Yogesh Mittal,Anupam Kher,Pavan Malhotra,unknown,Drama,yeh faasley,Anupam Kher Pavan Malhotra unknown Yogesh Mittal Drama
Anay,Anay,Kurush Deboo,Mohit Ghai,Comedy,happy husbands,Anay Kurush Deboo Mohit Ghai Anay Comedy
Sushen Bhatnagar,Divya Dutta,Ashutosh Rana,unknown,Drama,monica,Divya Dutta Ashutosh Rana unknown Sushen Bhatnagar Drama
Abhinay Deo,Abhishek Bachchan,Kangana Ranaut,Sarah Jane Dias,Mystery/Action,game,Abhishek Bachchan Kangana Ranaut Sarah Jane Dias Abhinay Deo Mystery/Action
Remo D'souza,Jackky Bhagnani,Puja Gupta,Arshad Warsi,Satire/Comedy/Teen film,f.a.l.t.u,Jackky Bhagnani Puja Gupta Arshad Warsi Remo D'souza Satire/Comedy/Teen film
Sanjoy Nag,Deepti Naval,Rituparno Ghosh,Raima Sen,Drama,memories in march,Deepti Naval Rituparno Ghosh Raima Sen Sanjoy Nag Drama
Anees Bazmee,Akshay Kumar,Bobby Deol,Sunil Shetty,Comedy,thank you,Akshay Kumar Bobby Deol Sunil Shetty Anees Bazmee Comedy
Mirgdeep Singh Lamba,Om Puri,Shreyas Talpade,Deepak Dobriyal,Drama,teen thay bhai,Om Puri Shreyas Talpade Deepak Dobriyal Mirgdeep Singh Lamba Drama
Rohan Sippy,Abhishek Bachchan,Bipasha Basu,Prateik Babbar,Thriller,dum maaro dum,Abhishek Bachchan Bipasha Basu Prateik Babbar Rohan Sippy Thriller
Satyajit Bhatkal,Darsheel Safary,Anupam Kher,Manjari Phadnis,Superhero/Children,zokkomon,Darsheel Safary Anupam Kher Manjari Phadnis Satyajit Bhatkal Superhero/Children
"Raj Nidimoru, Krishna Dk",Tusshar Kapoor,Preeti Desai,Alok Chaturvedi,Drama/Cult,shor in the city,"Tusshar Kapoor Preeti Desai Alok Chaturvedi Raj Nidimoru, Krishna Dk Drama/Cult"
Shashant Shah,Lara Dutta,Vinay Pathak,Akshay Kumar,Comedy Road movie,chalo dilli,Lara Dutta Vinay Pathak Akshay Kumar Shashant Shah Comedy Road movie
Onir,Sanjay Suri,Radhika Apte,Shernaz Patel,Social/Drama,i am,Sanjay Suri Radhika Apte Shernaz Patel Onir Social/Drama
Jagmohan Mundhra,Govinda,Yuvika Chaudhary,Anupam Kher,Comedy,naughty @ 40,Govinda Yuvika Chaudhary Anupam Kher Jagmohan Mundhra Comedy
Bumpy,Shraddha Kapoor,Taaha Shah,unknown,Teen/Comedy,luv ka the end,Shraddha Kapoor Taaha Shah unknown Bumpy Teen/Comedy
Vikram Bhatt,Mahakshay Chakraborty,Twinkle Bajpai,Achint Kaur,Horror,haunted – 3d,Mahakshay Chakraborty Twinkle Bajpai Achint Kaur Vikram Bhatt Horror
S. Manasvi,Tusshar Kapoor,Amrita Rao,unknown,Romance/Comedy,love u...mr. kalakaar!,Tusshar Kapoor Amrita Rao unknown S. Manasvi Romance/Comedy
Pawan Kripalani,Kainaz Motivala,Rajkummar Rao,unknown,Horror/Romance,ragini mms,Kainaz Motivala Rajkummar Rao unknown Pawan Kripalani Horror/Romance
Tigmanshu Dhulia,Nana Patekar,Zakir Hussain,Mohit Ahlawat,Action/Drama,shagird,Nana Patekar Zakir Hussain Mohit Ahlawat Tigmanshu Dhulia Action/Drama
Amole Gupte,Partho,Divya Dutta,unknown,Children,stanley ka dabba,Partho Divya Dutta unknown Amole Gupte Children
Prawaal Raman,Rajvvir Aroraa,Imaad Shah,Nishikant Kamat,Psychological thriller,404,Rajvvir Aroraa Imaad Shah Nishikant Kamat Prawaal Raman Psychological thriller
Anil Goyal,Nikhil Dwivedi,Smilie Suri,unknown,Animation,crackers,Nikhil Dwivedi Smilie Suri unknown Anil Goyal Animation
Luv Ranjan,Kartik Aaryan,Raayo S. Bakhirta,Divyendu Sharma,Romance/Comedy,pyaar ka punchnama,Kartik Aaryan Raayo S. Bakhirta Divyendu Sharma Luv Ranjan Romance/Comedy
Barnali Ray Shukla,Rahul Bose,Shefali Shah,unknown,Drama/Comedy,kucch luv jaisaa,Rahul Bose Shefali Shah unknown Barnali Ray Shukla Drama/Comedy
Anees Bazmee,Salman Khan,Asin,Paresh Rawal,Comedy,ready,Salman Khan Asin Paresh Rawal Anees Bazmee Comedy
Bijoy Nambiar,Rajeev Khandelwal,Kalki Koechlin,Shiv Panditt,Drama/Thriller,shaitan,Rajeev Khandelwal Kalki Koechlin Shiv Panditt Bijoy Nambiar Drama/Thriller
Sagar Ballary,Vinay Pathak,Minissha Lamba,Kay Kay Menon,Comedy,bheja fry 2,Vinay Pathak Minissha Lamba Kay Kay Menon Sagar Ballary Comedy
Roshan Abbas,Ali Fazal,Giselli Monteiro,Zoa Morani,Romance/Teen,always kabhi kabhi,Ali Fazal Giselli Monteiro Zoa Morani Roshan Abbas Romance/Teen
Ankush Bhatt,Kay Kay Menon,Piyush Mishra,Deepti Naval,Thriller,bhindi baazaar inc.,Kay Kay Menon Piyush Mishra Deepti Naval Ankush Bhatt Thriller
Chandrakant Singh,Rati Agnihotri,Gulshan Grover,Manoj Joshi,Crime,bin bulaye baraati,Rati Agnihotri Gulshan Grover Manoj Joshi Chandrakant Singh Crime
Indra Kumar,Sanjay Dutt,Arshad Warsi,Javed Jaffrey,Comedy,double dhamaal,Sanjay Dutt Arshad Warsi Javed Jaffrey Indra Kumar Comedy
Puri Jagannadh,Amitabh Bachchan,Charmy Kaur,Hema Malini,Action,bbuddah... hoga terra baap,Amitabh Bachchan Charmy Kaur Hema Malini Puri Jagannadh Action
Abhinay Deo,Imran Khan,Shenaz Treasurywala,Poorna Jagannathan,Action/Comedy,delhi belly,Imran Khan Shenaz Treasurywala Poorna Jagannathan Abhinay Deo Action/Comedy
Mohit Suri,Emraan Hashmi,Jacqueline Fernandez,Prashant Narayanan,Psychological thriller,murder 2,Emraan Hashmi Jacqueline Fernandez Prashant Narayanan Mohit Suri Psychological thriller
"Vikas Bahl, Nitesh Tiwari",Irrfan Khan,Sanath Menon,Rohan Grover,Children,chillar party,"Irrfan Khan Sanath Menon Rohan Grover Vikas Bahl, Nitesh Tiwari Children"
Zoya Akhtar,Hrithik Roshan,Katrina Kaif,Naseeruddin Shah,Romance/Road,zindagi na milegi dobara,Hrithik Roshan Katrina Kaif Naseeruddin Shah Zoya Akhtar Romance/Road
Rohit Shetty,Ajay Devgn,Kajal Aggarwal,Prakash Raj,Action,singham,Ajay Devgn Kajal Aggarwal Prakash Raj Rohit Shetty Action
Ajai Sinha,Om Puri,Govind Namdeo,Manoj Pahwa,Social,khap,Om Puri Govind Namdeo Manoj Pahwa Ajai Sinha Social
Rakesh Ranjan Kumar,Neha Dhupia,Raghubir Yadav,unknown,Biographical,gandhi to hitler,Neha Dhupia Raghubir Yadav unknown Rakesh Ranjan Kumar Biographical
Sanjivan Lal,Sohail Lakhani,Apoorva Arora,Sachin Khedekar,Drama,bubble gum,Sohail Lakhani Apoorva Arora Sachin Khedekar Sanjivan Lal Drama
Rajiv Mehra,Pankaj Kapoor,Deven Bhojani,Manoj Pahwa,Comedy/Social,chala mussaddi... office office,Pankaj Kapoor Deven Bhojani Manoj Pahwa Rajiv Mehra Comedy/Social
Nila Madhab Panda,Harsh Mayar,Gulshan Grover,unknown,Drama,i am kalam,Harsh Mayar Gulshan Grover unknown Nila Madhab Panda Drama
Ramesh Modi,Gracy Singh,Aslam Khan,Vishal Kaushik,Comedy/Romance,milta hai chance by chance,Gracy Singh Aslam Khan Vishal Kaushik Ramesh Modi Comedy/Romance
Karan Razdan,Jannat Zubair Rahmani,Atul Kulkarni,Rituparna Sengupta,Horror,warning,Jannat Zubair Rahmani Atul Kulkarni Rituparna Sengupta Karan Razdan Horror
Prakash Jha,Amitabh Bachchan,Saif Ali Khan,Manoj Bajpai,Social,aarakshan,Amitabh Bachchan Saif Ali Khan Manoj Bajpai Prakash Jha Social
Girish Dhamija,Rajneesh Duggal,Adah Sharma,Roshni Chopra,Thriller,phhir,Rajneesh Duggal Adah Sharma Roshni Chopra Girish Dhamija Thriller
Ajay Chandok,Sanjay Dutt,Ameesha Patel,Suresh Menon,Comedy,chatur singh two star,Sanjay Dutt Ameesha Patel Suresh Menon Ajay Chandok Comedy
Ram Gopal Varma,Mahie Gill,Deepak Dobriyal,Ajay Gehi,Crime,not a love story,Mahie Gill Deepak Dobriyal Ajay Gehi Ram Gopal Varma Crime
Parvin Dabas,Parvin Dabas,Sharat Saxena,Vansh Bharadwaj,Comedy,sahi dhandhe galat bande,Parvin Dabas Sharat Saxena Vansh Bharadwaj Parvin Dabas Comedy
Suneet Arora,Ravi Kissen,Rahul Singh,Rajesh Shringapure,Social,chitkabrey – shades of grey,Ravi Kissen Rahul Singh Rajesh Shringapure Suneet Arora Social
Lalit Marathe,Isha Koppikar,unknown,unknown,Action,shabri,Isha Koppikar unknown unknown Lalit Marathe Action
Deepshika,Deepshika,Kaishav Arora,unknown,Romance,yeh dooriyan,Deepshika Kaishav Arora unknown Deepshika Romance
Siddique,Salman Khan,Kareena Kapoor,Hazel Keech,Romance/Action,bodyguard,Salman Khan Kareena Kapoor Hazel Keech Siddique Romance/Action
Pammi Somal,Kirron Kher,Jackie Shroff,Divya Dutta,Comedy,mummy punjabi,Kirron Kher Jackie Shroff Divya Dutta Pammi Somal Comedy
Anurag Kashyap,Kalki Koechlin,Naseeruddin Shah,unknown,Social,that girl in yellow boots,Kalki Koechlin Naseeruddin Shah unknown Anurag Kashyap Social
Ali Abbas Zafar,Katrina Kaif,Imran Khan,Ali Zafar,Romance/Comedy,mere brother ki dulhan,Katrina Kaif Imran Khan Ali Zafar Ali Abbas Zafar Romance/Comedy
Ashok Nanda,Deepti Naval,Reema Lagoo,Meghna Naidu,Social,rivaaz,Deepti Naval Reema Lagoo Meghna Naidu Ashok Nanda Social
Pankaj Kapoor,Shahid Kapoor,Sonam Kapoor,Anupam Kher,Romance,mausam,Shahid Kapoor Sonam Kapoor Anupam Kher Pankaj Kapoor Romance
Robert Lieberman,Anupam Kher,Gurpreet Guggi,Vinay Virmani,Drama,speedy singhs,Anupam Kher Gurpreet Guggi Vinay Virmani Robert Lieberman Drama
Aron Govil,Mikaal Zulfikaar,Priti Soni,Aman Verma,Romance,u r my jaan,Mikaal Zulfikaar Priti Soni Aman Verma Aron Govil Romance
Nishikant Kamat,John Abraham,Genelia D'Souza,unknown,Action,force,John Abraham Genelia D'Souza unknown Nishikant Kamat Action
Sagar Ballary,Tusshar Kapoor,Shreyas Talpade,Minnisha Lamba,Romance/Comedy,hum tum shabana,Tusshar Kapoor Shreyas Talpade Minnisha Lamba Sagar Ballary Romance/Comedy
Tigmanshu Dhulia,Jimmy Sheirgill,Mahie Gill,Randeep Hooda,Action/Thriller,"saheb, biwi aur gangster",Jimmy Sheirgill Mahie Gill Randeep Hooda Tigmanshu Dhulia Action/Thriller
Deepa Sahi,Vinay Pathak,Riya Sen,Jagrat Desai,Romantic/Comedy,tere mere phere,Vinay Pathak Riya Sen Jagrat Desai Deepa Sahi Romantic/Comedy
Dev Anand,Dev Anand,Jackie Shroff,Naseeruddin Shah,Drama/Thriller,chargesheet,Dev Anand Jackie Shroff Naseeruddin Shah Dev Anand Drama/Thriller
Pammi Somal,Garry Gill,Amrita Prakash,Sharat Saxena,Romance,na jaane kabse hum hi,Garry Gill Amrita Prakash Sharat Saxena Pammi Somal Romance
David Dhawan,Ajay Devgn,Sanjay Dutt,Arjun Rampal,Comedy/Action,rascals,Ajay Devgn Sanjay Dutt Arjun Rampal David Dhawan Comedy/Action
Sahil Sangha,Zayed Khan,Dia Mirza,Cyrus Sahukar,Romantic,love breakups zindagi,Zayed Khan Dia Mirza Cyrus Sahukar Sahil Sangha Romantic
Raghav Dar,Prateik Babbar,Kalki Koechlin,Manisha Koirala,Romance/Comedy/Crime,my friend pinto,Prateik Babbar Kalki Koechlin Manisha Koirala Raghav Dar Romance/Comedy/Crime
Nupur Asthana,Saqib Saleem,Saba Azad,Nishant Dahiya,Comedy/Romance,mujhse fraaandship karoge,Saqib Saleem Saba Azad Nishant Dahiya Nupur Asthana Comedy/Romance
Nagesh Kukunoor,Ayesha Takia,Rannvijay Singh,Raghuvir Yadav,Romance/Drama,mod,Ayesha Takia Rannvijay Singh Raghuvir Yadav Nagesh Kukunoor Romance/Drama
Prashant Chadha,Sachiin J Joshi,Candice Boucher,Arya Babbar,Action/Thriller,aazaan,Sachiin J Joshi Candice Boucher Arya Babbar Prashant Chadha Action/Thriller
Ashu Trikha,Shreyas Talpade,Mugdha Godse,Johnny Lever,Comedy,oh god! saare hain fraud,Shreyas Talpade Mugdha Godse Johnny Lever Ashu Trikha Comedy
Anubhav Sinha,Shahrukh Khan,Kareena Kapoor,Arjun Rampal,Action/Sci-Fi,ra.one,Shahrukh Khan Kareena Kapoor Arjun Rampal Anubhav Sinha Action/Sci-Fi
"Mayur Puri, Hema Malini",Esha Deol,Vinod Khanna,Rishi Kapoor,Drama,tell me o kkhuda,"Esha Deol Vinod Khanna Rishi Kapoor Mayur Puri, Hema Malini Drama"
Swapna Waghmare,Himesh Reshammiya,Purbi Joshi,Sonal Sehgal,Comedy,damadamm!,Himesh Reshammiya Purbi Joshi Sonal Sehgal Swapna Waghmare Comedy
Rajneesh Thakur,Govinda,Suniel Shetty,Javed Jaffrey,Comedy,loot,Govinda Suniel Shetty Javed Jaffrey Rajneesh Thakur Comedy
Tanveer Khan,Chirag Paswan,Kangana Ranaut,Kabir Bedi,Romance/Drama,miley naa miley hum,Chirag Paswan Kangana Ranaut Kabir Bedi Tanveer Khan Romance/Drama
