director_name,actor_1_name,actor_2_name,actor_3_name,genres,movie_title,comb
Prakash Jha,Amitabh Bachchan,Ajay Devgn,Kareena Kapoor,Political Thriller,satyagraha,Amitabh Bachchan Ajay Devgn Kareena Kapoor Prakash Jha Political Thriller
Apoorva Lakhia,Ram Charan,Priyanka Chopra,Sanjay Dutt,"Action, Thriller",zanjeer,"Ram Charan Priyanka Chopra Sanjay Dutt Apoorva Lakhia Action, Thriller"
Maneesh Sharma,Sushant Singh Rajput,Parineeti Chopra,Vaani Kapoor,Romance,shuddh desi romance,Sushant Singh Rajput Parineeti Chopra Vaani Kapoor Maneesh Sharma Romance
Karan Kashyap,Avinash Bhargava,Leena,Samarth Chaturvedi,Comedy,zindagi jalebi,Avinash Bhargava Leena Samarth Chaturvedi Karan Kashyap Comedy
Richie Mehta,Rajesh Tailang,unknown,unknown,Drama,siddharth,Rajesh Tailang unknown unknown Richie Mehta Drama
Indra Kumar,Riteish Deshmukh,Vivek Oberoi,Aftab Shivdasani,Adult Comedy,grand masti,Riteish Deshmukh Vivek Oberoi Aftab Shivdasani Indra Kumar Adult Comedy
Ahishor Solomon,Naseeruddin Shah,Randeep Hooda[85],unknown,Thriller,john day,Naseeruddin Shah Randeep Hooda[85] unknown Ahishor Solomon Thriller
Ayush Raina,Karan Kundra,Nishant Singh Malkani,Ravish Desai,Horror,horror story,Karan Kundra Nishant Singh Malkani Ravish Desai Ayush Raina Horror
Rajkumar Santoshi,Shahid Kapoor,Ileana D'Cruz,Parul Yadav,"Rom Com, Action",phata poster nikhla hero,"Shahid Kapoor Ileana D'Cruz Parul Yadav Rajkumar Santoshi Rom Com, Action"
Ritesh Batra,Irrfan Khan,Nawazuddin Siddiqui,Bharati Achrekar[88],Drama,the lunchbox,Irrfan Khan Nawazuddin Siddiqui Bharati Achrekar[88] Ritesh Batra Drama
Gurmmeet Singh,Santosh Barmola,Suzana Rodrigues,Manjari Fadnis,Thriller,warning,Santosh Barmola Suzana Rodrigues Manjari Fadnis Gurmmeet Singh Thriller
Jaideep Chopra,Sumeet Nijhawan,Mona Wasu,Pankaj Tripathi,Suspense Thriller,maazii,Sumeet Nijhawan Mona Wasu Pankaj Tripathi Jaideep Chopra Suspense Thriller
Ashish R Shukla,Chandan Roy Sanyal,Elena Kazan,Arfi Lamba,"Psychological Thriller, Romance",prague,"Chandan Roy Sanyal Elena Kazan Arfi Lamba Ashish R Shukla Psychological Thriller, Romance"
Navin Batra,Veena Malik,Ashmit Patel,Jackie Shroff[92],Drama,super model,Veena Malik Ashmit Patel Jackie Shroff[92] Navin Batra Drama
Abhinav Kashyap,Ranbir Kapoor,Pallavi Sharda,Rishi Kapoor,Comedy/Action,besharam,Ranbir Kapoor Pallavi Sharda Rishi Kapoor Abhinav Kashyap Comedy/Action
Faraz Haider,Sharman Joshi,Javed Jaffrey,Soha Ali Khan,War comedy,war chhod na yaar,Sharman Joshi Javed Jaffrey Soha Ali Khan Faraz Haider War comedy
Shuja Ali,Ali Fazal,Gulshan Grover,Anisa[95],Comedy,baat bann gayi,Ali Fazal Gulshan Grover Anisa[95] Shuja Ali Comedy
Monish Kaushal,Nisha Triloki,Rajender Thakur,Gopal Thakur[96],Drama,ekk thee sanam,Nisha Triloki Rajender Thakur Gopal Thakur[96] Monish Kaushal Drama
Aziz Sejawal,Arya Babbar,Prosenjit Chatterjee,Sayantika Banerjee,Crime,paapi - ek satya katha,Arya Babbar Prosenjit Chatterjee Sayantika Banerjee Aziz Sejawal Crime
Anthony D'Souza,Akshay Kumar,Mithun Chakraborty,Danny Denzongpa,Masala,boss,Akshay Kumar Mithun Chakraborty Danny Denzongpa Anthony D'Souza Masala
Hansal Mehta,Rajkummar Rao,Tigmanshu Dhulia,Kay Kay Menon,Drama/Biography,shahid,Rajkummar Rao Tigmanshu Dhulia Kay Kay Menon Hansal Mehta Drama/Biography
Babloo Seshadri,Chirag Patil,Sai Tamhankar,Manoj Joshi,Political/Drama,wake up india,Chirag Patil Sai Tamhankar Manoj Joshi Babloo Seshadri Political/Drama
Apurv Bajpai,Rohan Jardosh,Saurabh Singh,Gunjan Vyas,Crime/Drama,amdavad junction,Rohan Jardosh Saurabh Singh Gunjan Vyas Apurv Bajpai Crime/Drama
Ashish Tyagi,Darshan Jariwala,Neena Kulkarni,Yashpal Sharma,Crime,dilli gang,Darshan Jariwala Neena Kulkarni Yashpal Sharma Ashish Tyagi Crime
Saurabh Varma,Manish Paul,Elli Avram,Varun Badola,Comedy/Thriller,mickey virus,Manish Paul Elli Avram Varun Badola Saurabh Varma Comedy/Thriller
Anish Khanna,Rajeev Khandelwal,Rayo Bakhirta,Neha Ahuja,Romance,ishk actually,Rajeev Khandelwal Rayo Bakhirta Neha Ahuja Anish Khanna Romance
Shekhar Ghosh,Vir Das,Kirti Kulhari,Gulshan Grover,Comedy,sooper se ooper,Vir Das Kirti Kulhari Gulshan Grover Shekhar Ghosh Comedy
Rakesh Roshan,Hrithik Roshan,Priyanka Chopra,Kangana Ranaut,Superhero,krrish 3,Hrithik Roshan Priyanka Chopra Kangana Ranaut Rakesh Roshan Superhero
Ram Gopal Varma,Puneet Singh Ratn,"Anaika Soti,[107] Mahesh Thakur","Aradhna Gupta,[108][109] Raj Premi",Crime,satya 2,"Puneet Singh Ratn Anaika Soti,[107] Mahesh Thakur Aradhna Gupta,[108][109] Raj Premi Ram Gopal Varma Crime"
Vishwas Patil,Kangana Ranaut,Paras Arora,Mahesh Manjrekar,Romance,rajjo,Kangana Ranaut Paras Arora Mahesh Manjrekar Vishwas Patil Romance
Sanjay Leela Bhansali,Ranveer Singh,Deepika Padukone,Richa Chadda,Romance/Drama,goliyon ki raasleela ram-leela,Ranveer Singh Deepika Padukone Richa Chadda Sanjay Leela Bhansali Romance/Drama
Santosh K. Gupta,Suraj K. Shah,J. B. Rana,Dipanshi,Drama,kaand: black scandal,Suraj K. Shah J. B. Rana Dipanshi Santosh K. Gupta Drama
Punit Malhotra,Imran Khan,Kareena Kapoor,Shraddha Kapoor,Romance/Comedy,gori tere pyaar mein,Imran Khan Kareena Kapoor Shraddha Kapoor Punit Malhotra Romance/Comedy
Anil Sharma,Sunny Deol,Amrita Rao,Johny Lever,Action,singh saab the great,Sunny Deol Amrita Rao Johny Lever Anil Sharma Action
Tigmanshu Dhulia,Saif Ali Khan,Sonakshi Sinha,Jimmy Sheirgill,Comedy/Crime/Romance,bullett raja,Saif Ali Khan Sonakshi Sinha Jimmy Sheirgill Tigmanshu Dhulia Comedy/Crime/Romance
Prabhudeva,Shahid Kapoor,Sonakshi Sinha,Sonu Sood,Action/Romance,r... rajkumar,Shahid Kapoor Sonakshi Sinha Sonu Sood Prabhudeva Action/Romance
Kaizad Gustad,Sachiin J Joshi,Naseeruddin Shah,Sunny Leone[116],Thriller/Comedy,jackpot,Sachiin J Joshi Naseeruddin Shah Sunny Leone[116] Kaizad Gustad Thriller/Comedy
Gurmmet Singh,Dimple Kapadia,Manu Rishi,Manjot Singh,Drama,what the fish,Dimple Kapadia Manu Rishi Manjot Singh Gurmmet Singh Drama
Vijay Krishna Acharya,Aamir Khan,Abhishek Bachchan,Katrina Kaif,Action,dhoom 3,Aamir Khan Abhishek Bachchan Katrina Kaif Vijay Krishna Acharya Action
