director_name,actor_1_name,actor_2_name,actor_3_name,genres,movie_title,comb
Apoorva Lakhia,Ram Charan,Priyanka Chopra,Sanjay Dutt,"Action, Thriller",zanjeer,"Ram Charan Priyanka Chopra Sanjay Dutt Apoorva Lakhia Action, Thriller"
Maneesh Sharma,Sushant Singh Rajput,Parineeti Chopra,Vaani Kapoor,Romance,shuddh desi romance,Sushant Singh Rajput Parineeti Chopra Vaani Kapoor Maneesh Sharma Romance
Karan Kashyap,Avinash Bhargava,Leena,Samarth Chaturvedi,Comedy,zindagi jalebi,Avinash Bhargava Leena Samarth Chaturvedi Karan Kashyap Comedy
Richie Mehta,Rajesh Tailang,unknown,unknown,Drama,siddharth,Rajesh Tailang unknown unknown Richie Mehta Drama
Indra Kumar,Riteish Deshmukh,Vivek Oberoi,Aftab Shivdasani,Adult Comedy,grand masti,Riteish Deshmukh Vivek Oberoi Aftab Shivdasani Indra Kumar Adult Comedy
Ahishor Solomon,Naseeruddin Shah,Randeep Hooda[85],unknown,Thriller,john day,Naseeruddin Shah Randeep Hooda[85] unknown Ahishor Solomon Thriller
Ayush Raina,Karan Kundra,Nishant Singh Malkani,Ravish Desai,Horror,horror story,Karan Kundra Nishant Singh Malkani Ravish Desai Ayush Raina Horror
Rajkumar Santoshi,Shahid Kapoor,Ileana D'Cruz,Parul Yadav,"Rom Com, Action",phata poster nikhla hero,"Shahid Kapoor Ileana D'Cruz Parul Yadav Rajkumar Santoshi Rom Com, Action"
Ritesh Batra,Irrfan Khan,Nawazuddin Siddiqui,Bharati Achrekar[88],Drama,the lunchbox,Irrfan Khan Nawazuddin Siddiqui Bharati Achrekar[88] Ritesh Batra Drama
Gurmmeet Singh,Santosh Barmola,Suzana Rodrigues,Manjari Fadnis,Thriller,warning,Santosh Barmola Suzana Rodrigues Manjari Fadnis Gurmmeet Singh Thriller
Jaideep Chopra,Sumeet Nijhawan,Mona Wasu,Pankaj Tripathi,Suspense Thriller,maazii,Sumeet Nijhawan Mona Wasu Pankaj Tripathi Jaideep Chopra Suspense Thriller
Ashish R Shukla,Chandan Roy Sanyal,Elena Kazan,Arfi Lamba,"Psychological Thriller, Romance",prague,"Chandan Roy Sanyal Elena Kazan Arfi Lamba Ashish R Shukla Psychological Thriller, Romance"
Navin Batra,Veena Malik,Ashmit Patel,Jackie Shroff[92],Drama,super model,Veena Malik Ashmit Patel Jackie Shroff[92] Navin Batra Drama
Abhinav Kashyap,Ranbir Kapoor,Pallavi Sharda,Rishi Kapoor,Comedy/Action,besharam,Ranbir Kapoor Pallavi Sharda Rishi Kapoor Abhinav Kashyap Comedy/Action
Faraz Haider,Sharman Joshi,Javed Jaffrey,Soha Ali Khan,War comedy,war chhod na yaar,Sharman Joshi Javed Jaffrey Soha Ali Khan Faraz Haider War comedy
Shuja Ali,Ali Fazal,Gulshan Grover,Anisa[95],Comedy,baat bann gayi,Ali Fazal Gulshan Grover Anisa[95] Shuja Ali Comedy
Monish Kaushal,Nisha Triloki,Rajender Thakur,Gopal Thakur[96],Drama,ekk thee sanam,Nisha Triloki Rajender Thakur Gopal Thakur[96] Monish Kaushal Drama
Aziz Sejawal,Arya Babbar,Prosenjit Chatterjee,Sayantika Banerjee,Crime,paapi - ek satya katha,Arya Babbar Prosenjit Chatterjee Sayantika Banerjee Aziz Sejawal Crime
Anthony D'Souza,Akshay Kumar,Mithun Chakraborty,Danny Denzongpa,Masala,boss,Akshay Kumar Mithun Chakraborty Danny Denzongpa Anthony D'Souza Masala
Hansal Mehta,Rajkummar Rao,Tigmanshu Dhulia,Kay Kay Menon,Drama/Biography,shahid,Rajkummar Rao Tigmanshu Dhulia Kay Kay Menon Hansal Mehta Drama/Biography
Babloo Seshadri,Chirag Patil,Sai Tamhankar,Manoj Joshi,Political/Drama,wake up india,Chirag Patil Sai Tamhankar Manoj Joshi Babloo Seshadri Political/Drama
Apurv Bajpai,Rohan Jardosh,Saurabh Singh,Gunjan Vyas,Crime/Drama,amdavad junction,Rohan Jardosh Saurabh Singh Gunjan Vyas Apurv Bajpai Crime/Drama
Ashish Tyagi,Darshan Jariwala,Neena Kulkarni,Yashpal Sharma,Crime,dilli gang,Darshan Jariwala Neena Kulkarni Yashpal Sharma Ashish Tyagi Crime
Saurabh Varma,Manish Paul,Elli Avram,Varun Badola,Comedy/Thriller,mickey virus,Manish Paul Elli Avram Varun Badola Saurabh Varma Comedy/Thriller
Anish Khanna,Rajeev Khandelwal,Rayo Bakhirta,Neha Ahuja,Romance,ishk actually,Rajeev Khandelwal Rayo Bakhirta Neha Ahuja Anish Khanna Romance
Shekhar Ghosh,Vir Das,Kirti Kulhari,Gulshan Grover,Comedy,sooper se ooper,Vir Das Kirti Kulhari Gulshan Grover Shekhar Ghosh Comedy
Rakesh Roshan,Hrithik Roshan,Priyanka Chopra,Kangana Ranaut,Superhero,krrish 3,Hrithik Roshan Priyanka Chopra Kangana Ranaut Rakesh Roshan Superhero
Ram Gopal Varma,Puneet Singh Ratn,"Anaika Soti,[107] Mahesh Thakur","Aradhna Gupta,[108][109] Raj Premi",Crime,satya 2,"Puneet Singh Ratn Anaika Soti,[107] Mahesh Thakur Aradhna Gupta,[108][109] Raj Premi Ram Gopal Varma Crime"
Vishwas Patil,Kangana Ranaut,Paras Arora,Mahesh Manjrekar,Romance,rajjo,Kangana Ranaut Paras Arora Mahesh Manjrekar Vishwas Patil Romance
Sanjay Leela Bhansali,Ranveer Singh,Deepika Padukone,Richa Chadda,Romance/Drama,goliyon ki raasleela ram-leela,Ranveer Singh Deepika Padukone Richa Chadda Sanjay Leela Bhansali Romance/Drama
Santosh K. Gupta,Suraj K. Shah,J. B. Rana,Dipanshi,Drama,kaand: black scandal,Suraj K. Shah J. B. Rana Dipanshi Santosh K. Gupta Drama
Punit Malhotra,Imran Khan,Kareena Kapoor,Shraddha Kapoor,Romance/Comedy,gori tere pyaar mein,Imran Khan Kareena Kapoor Shraddha Kapoor Punit Malhotra Romance/Comedy
Anil Sharma,Sunny Deol,Amrita Rao,Johny Lever,Action,singh saab the great,Sunny Deol Amrita Rao Johny Lever Anil Sharma Action
Tigmanshu Dhulia,Saif Ali Khan,Sonakshi Sinha,Jimmy Sheirgill,Comedy/Crime/Romance,bullett raja,Saif Ali Khan Sonakshi Sinha Jimmy Sheirgill Tigmanshu Dhulia Comedy/Crime/Romance
Prabhudeva,Shahid Kapoor,Sonakshi Sinha,Sonu Sood,Action/Romance,r... rajkumar,Shahid Kapoor Sonakshi Sinha Sonu Sood Prabhudeva Action/Romance
Kaizad Gustad,Sachiin J Joshi,Naseeruddin Shah,Sunny Leone[116],Thriller/Comedy,jackpot,Sachiin J Joshi Naseeruddin Shah Sunny Leone[116] Kaizad Gustad Thriller/Comedy
Gurmmet Singh,Dimple Kapadia,Manu Rishi,Manjot Singh,Drama,what the fish,Dimple Kapadia Manu Rishi Manjot Singh Gurmmet Singh Drama
Vijay Krishna Acharya,Aamir Khan,Abhishek Bachchan,Katrina Kaif,Action,dhoom 3,Aamir Khan Abhishek Bachchan Katrina Kaif Vijay Krishna Acharya Action
Samir Tiwari,Arshad Warsi,Soha Ali Khan,Javed Jaffrey,Comedy,mr joe b. carvalho,Arshad Warsi Soha Ali Khan Javed Jaffrey Samir Tiwari Comedy
Ramesh Sippy,Dharmendra,Amitabh Bachchan,Hema Malini,Action/Adventure,sholay 3d,Dharmendra Amitabh Bachchan Hema Malini Ramesh Sippy Action/Adventure
Abhishek Chaubey,Naseeruddin Shah,Arshad Warsi,Madhuri Dixit,Black Comedy/Thriller,dedh ishqiya,Naseeruddin Shah Arshad Warsi Madhuri Dixit Abhishek Chaubey Black Comedy/Thriller
Divya Khosla Kumar,Himansh Kohli,Shreyas Pardiwalla,Dev Sharma,Romance,yaariyan,Himansh Kohli Shreyas Pardiwalla Dev Sharma Divya Khosla Kumar Romance
Rajesh Pandey,Shiv Darshan,Hasleen Kaur,unknown,Romance,karle pyaar karle,Shiv Darshan Hasleen Kaur unknown Rajesh Pandey Romance
Ashim Ahluwalia,Nawazuddin Siddiqui,Niharika Singh,unknown,Drama,miss lovely,Nawazuddin Siddiqui Niharika Singh unknown Ashim Ahluwalia Drama
Kamal Swaroop,Aditya Lakhia,Manish Gupta,Anita Kanwar,Experimental,om-dar-b-dar,Aditya Lakhia Manish Gupta Anita Kanwar Kamal Swaroop Experimental
Sachin Gupta,Anuj Saxena,Neha Pawar,Mohinder Gujral,Romantic comedy,paranthe wali gali,Anuj Saxena Neha Pawar Mohinder Gujral Sachin Gupta Romantic comedy
Sanghamitra Chaudhari,Zeenat Aman,Indrani Haldar,Shubh Mukherjee,Drama,strings of passion,Zeenat Aman Indrani Haldar Shubh Mukherjee Sanghamitra Chaudhari Drama
Sohail Khan,Salman Khan,Daisy Shah,Tabu,Action – comedy,jai ho,Salman Khan Daisy Shah Tabu Sohail Khan Action – comedy
Devika Bhagat,Abhay Deol,Preeti Desai,Rati Agnihotri,Romance/Comedy,one by two,Abhay Deol Preeti Desai Rati Agnihotri Devika Bhagat Romance/Comedy
Nila Madhab Panda,Sahil Anand,Erica Fernandes,Preet Kamal,Comedy,babloo happy hai,Sahil Anand Erica Fernandes Preet Kamal Nila Madhab Panda Comedy
Vinil Mathew,Sidharth Malhotra,Parineeti Chopra,Adah Sharma,Romance/Comedy,hasee toh phasee,Sidharth Malhotra Parineeti Chopra Adah Sharma Vinil Mathew Romance/Comedy
Shekhar Suman,Adhyayan Suman,Ariana Ayam,Om Puri,Thriller,heartless,Adhyayan Suman Ariana Ayam Om Puri Shekhar Suman Thriller
Hasnain Hyderabadwala,Manzar Sehbai,Ajaz Khan,Akhilendra Mishra,Drama/Social,ya rab,Manzar Sehbai Ajaz Khan Akhilendra Mishra Hasnain Hyderabadwala Drama/Social
Ali Abbas Zafar,Ranveer Singh,Arjun Kapoor,Priyanka Chopra,Action,gunday,Ranveer Singh Arjun Kapoor Priyanka Chopra Ali Abbas Zafar Action
Sanjay Niranjan,Sikandar,Roshni,Raja,Social,kaho na kaho,Sikandar Roshni Raja Sanjay Niranjan Social
Pawan Kripalani,Jimmy Sheirgill,Nushrat Bharucha,Arif Zakaria,Horror,darr @ the mall,Jimmy Sheirgill Nushrat Bharucha Arif Zakaria Pawan Kripalani Horror
Jay Prakash,Prashant Narayanan,Arif Zakaria,Aman Verma,Drama,dee saturday night,Prashant Narayanan Arif Zakaria Aman Verma Jay Prakash Drama
Nishtha Jain,Sampat Pal Devi,unknown,unknown,Documentary,gulabi gang,Sampat Pal Devi unknown unknown Nishtha Jain Documentary
Imtiaz Ali,Randeep Hooda,Alia Bhatt,unknown,Drama/Romance,highway,Randeep Hooda Alia Bhatt unknown Imtiaz Ali Drama/Romance
Sabir,Tarun Arora,Mahek Chahal,Jyothi Rana,Thriller,karar: the deal,Tarun Arora Mahek Chahal Jyothi Rana Sabir Thriller
Shailendra Singh Rajput,Ishrat Ali,Rudraksh Pundhir,Rajni Mehta,Drama,pyar ka live show,Ishrat Ali Rudraksh Pundhir Rajni Mehta Shailendra Singh Rajput Drama
Shiraz Henry,Natasha Sikka,J. Brandon Hill,Alex Peters,Drama/Action,the dark secrets of tonhi,Natasha Sikka J. Brandon Hill Alex Peters Shiraz Henry Drama/Action
Raju Mavani,Sachin Khedekar,Smita Jaykar,Disha Choudhary,Drama,anuradha,Sachin Khedekar Smita Jaykar Disha Choudhary Raju Mavani Drama
Saket Chaudhary,Farhan Akhtar,Vidya Balan,Vir Das,Romance/Comedy,shaadi ke side effects,Farhan Akhtar Vidya Balan Vir Das Saket Chaudhary Romance/Comedy
"Rizwan Qazi, Qasim Bilal, Adil Ahmed",Horror,unknown,unknown,Abrar Qazi,akela the alone,"Horror unknown unknown Rizwan Qazi, Qasim Bilal, Adil Ahmed Abrar Qazi"
Soumik Sen,Madhuri Dixit,Juhi Chawla,unknown,Social/Action,gulaab gang,Madhuri Dixit Juhi Chawla unknown Soumik Sen Social/Action
Vikas Bahl,Kangana Ranaut,Rajkummar Rao,Lisa Haydon,Romance/Drama,queen,Kangana Ranaut Rajkummar Rao Lisa Haydon Vikas Bahl Romance/Drama
E Niwas,Ali Zafar,Yami Gautam,Sara Khan,Drama/Comedy,total siyapaa,Ali Zafar Yami Gautam Sara Khan E Niwas Drama/Comedy
Nupur Asthana,Ayushmann Khurrana,Sonam Kapoor,Rishi Kapoor,Romance,bewakoofiyaan,Ayushmann Khurrana Sonam Kapoor Rishi Kapoor Nupur Asthana Romance
Shyam Ramsay,Arbaaz Ali Khan,Roushika Reikhi,Shakti Kapoor,Horror,neighbours,Arbaaz Ali Khan Roushika Reikhi Shakti Kapoor Shyam Ramsay Horror
Tarun Madan Chopra,Danish Pandor,Raaj Singh Arora,Leslie Tripathy,Thriller,w,Danish Pandor Raaj Singh Arora Leslie Tripathy Tarun Madan Chopra Thriller
Rajat Kapoor,Sanjay Mishra,Rajat Kapoor,Samit Das,Comedy,ankhon dekhi,Sanjay Mishra Rajat Kapoor Samit Das Rajat Kapoor Comedy
Satish Kaushik,Parambrata Chatterjee,Sharman Joshi,Mahie Gill,Horror Comedy,gang of ghosts,Parambrata Chatterjee Sharman Joshi Mahie Gill Satish Kaushik Horror Comedy
Nagesh Kukunoor,Monali Thakur,Satish Kaushik,Shefali Shetty,Drama,lakshmi,Monali Thakur Satish Kaushik Shefali Shetty Nagesh Kukunoor Drama
Bhushan Patel,Sunny Leone,Parvin Dabas,Divya Dutta,Horror/Adult,ragini mms 2,Sunny Leone Parvin Dabas Divya Dutta Bhushan Patel Horror/Adult
Sanamjit Talwar,Sunny Deol,Harman Baweja,Ayesha Khanna,Action,dishkiyaoon,Sunny Deol Harman Baweja Ayesha Khanna Sanamjit Talwar Action
Umesh Bist,Pulkit Samrat,Sarah-Jane Dias,Bilal Amrohi,Comedy,o teri,Pulkit Samrat Sarah-Jane Dias Bilal Amrohi Umesh Bist Comedy
Saad Khan,Sameer Kevin Roy,Kanika Batra,Vibhinta Verma,Thriller,station,Sameer Kevin Roy Kanika Batra Vibhinta Verma Saad Khan Thriller
Syed Ahmad Afzal,Jackky Bhagnani,Neha Sharma,Farooq Shaikh,Drama,youngistaan,Jackky Bhagnani Neha Sharma Farooq Shaikh Syed Ahmad Afzal Drama
Varun Middha,Omkar Das Manikpuri,Rajeev Verma,Dev Gohar,Sci-fi/Comedy,ebn-e-batuta,Omkar Das Manikpuri Rajeev Verma Dev Gohar Varun Middha Sci-fi/Comedy
Avtar Bhogal,Zara Sheikh,Sandeep Singh,Tom Alter,Social,honour killing,Zara Sheikh Sandeep Singh Tom Alter Avtar Bhogal Social
Girish Malik,Purab Kohli,Tannishtha Chatterjee,Kirti Kulhari,Drama/Fantasy,jal,Purab Kohli Tannishtha Chatterjee Kirti Kulhari Girish Malik Drama/Fantasy
David Dhawan,Varun Dhawan,Ileana D'Cruz,Nargis Fakhri,Comedy,main tera hero,Varun Dhawan Ileana D'Cruz Nargis Fakhri David Dhawan Comedy
Nitesh Tiwari,Amitabh Bachchan,Parth Bhalerao,Boman Irani,Fantasy/Children,bhoothnath returns,Amitabh Bachchan Parth Bhalerao Boman Irani Nitesh Tiwari Fantasy/Children
Abhishek Varman,Arjun Kapoor,Alia Bhatt,Amrita Singh,Romance,2 states,Arjun Kapoor Alia Bhatt Amrita Singh Abhishek Varman Romance
Feroz Abbas Khan,Satish Kaushik,Ganesh Yadav,unknown,Comedy,dekh tamasha dekh,Satish Kaushik Ganesh Yadav unknown Feroz Abbas Khan Comedy
Shammi Chhabra,Ravi Kishan,Eijaz Khan,Kulraj Randhawa,Romance/Comedy,lucky kabootar,Ravi Kishan Eijaz Khan Kulraj Randhawa Shammi Chhabra Romance/Comedy
Subhash Ghai,Mishti,Kartik Aaryan,Rishi Kapoor,Musical/Drama,kaanchi: the unbreakable,Mishti Kartik Aaryan Rishi Kapoor Subhash Ghai Musical/Drama
Sai Kabir,Kangana Ranaut,Vir Das,Piyush Mishra,Drama,revolver rani,Kangana Ranaut Vir Das Piyush Mishra Sai Kabir Drama
Kaushik Ghatak,Rajeev Khandelwal,Madalasa Sharma,unknown,Mystery/Thriller/Drama,samrat & co.,Rajeev Khandelwal Madalasa Sharma unknown Kaushik Ghatak Mystery/Thriller/Drama
Tanushri Chattrji Bassu,Tanuj Virwani,Aditya Seal,Izabelle Leite,Romance/Drama,purani jeans,Tanuj Virwani Aditya Seal Izabelle Leite Tanushri Chattrji Bassu Romance/Drama
Vijay Raaz,Vijay Raaz,Manu Rishi,Raj Zutshi,Social,kya dilli kya lahore,Vijay Raaz Manu Rishi Raj Zutshi Vijay Raaz Social
Ramesh Rout,Ajay Sinh Rathod,Prachi Sinha,unknown,Action,angry young man,Ajay Sinh Rathod Prachi Sinha unknown Ramesh Rout Action
Mahesh Vaijnath Doijode,Abhishek Sethiya,Sonia Mann,Sanjay Kapoor,Romance,kahin hai mera pyar,Abhishek Sethiya Sonia Mann Sanjay Kapoor Mahesh Vaijnath Doijode Romance
Amole Gupte,Partho Gupte,Saqib Saleem,Pragya Yadav,Drama,hawaa hawaai,Partho Gupte Saqib Saleem Pragya Yadav Amole Gupte Drama
Zaid Ali Khan,Navdip Singh,Simer Motiani,Nafisa Ali,Romance/Drama,khwaabb,Navdip Singh Simer Motiani Nafisa Ali Zaid Ali Khan Romance/Drama
Ashu Trikha,Vinod Khanna,Suniel Shetty,Vipino,Action,koyelaanchal,Vinod Khanna Suniel Shetty Vipino Ashu Trikha Action
Sandeep A. Varma,Divya Dutta,Seema Biswas,Asif Basra,Drama,manjunath,Divya Dutta Seema Biswas Asif Basra Sandeep A. Varma Drama
Akhilesh Jaiswal,Rahul Bagga,Tara Alisha Berry,unknown,Adult,mastram,Rahul Bagga Tara Alisha Berry unknown Akhilesh Jaiswal Adult
Janaki Vishwanathan,Anshuman Jha,Asif Basra,Amit Sial,Comedy,yeh hai bakrapur,Anshuman Jha Asif Basra Amit Sial Janaki Vishwanathan Comedy
Ananth Narayan Mahadevan,Himesh Reshammiya,Sonali Raut,Yo Yo Honey Singh,Thriller,the xposé,Himesh Reshammiya Sonali Raut Yo Yo Honey Singh Ananth Narayan Mahadevan Thriller
Mrityunjay Devvrat,Farooq Shaikh,Victor Banerjee,Pawan Malhotra,Drama,children of war,Farooq Shaikh Victor Banerjee Pawan Malhotra Mrityunjay Devvrat Drama
Braj Bhushan,Paras Chhabra,Sara Khan,M.A. Guddu,Mystery,m3 - midsummer midnight mumbai,Paras Chhabra Sara Khan M.A. Guddu Braj Bhushan Mystery
Sabbir Khan,Tiger Shroff,Kriti Sanon & Prakash Raj,unknown,Romance/Action,heropanti,Tiger Shroff Kriti Sanon & Prakash Raj unknown Sabbir Khan Romance/Action
Hansal Mehta,Rajkummar Rao,Patralekha,unknown,Drama,citylights,Rajkummar Rao Patralekha unknown Hansal Mehta Drama
Aman Sachdeva,Siddharth Gupta,Simran Kaur Mundi,Pallavi Batra,Comedy,kuku mathur ki jhand ho gayi,Siddharth Gupta Simran Kaur Mundi Pallavi Batra Aman Sachdeva Comedy
Nitin Kakkar,Sharib Hashmi,Inaamulhaq,Kumud Mishra,Comedy,filmistaan,Sharib Hashmi Inaamulhaq Kumud Mishra Nitin Kakkar Comedy
A.R. Murugadoss,Akshay Kumar,Sonakshi Sinha,Govinda,Action/Thriller,holiday: a soldier is never off duty,Akshay Kumar Sonakshi Sinha Govinda A.R. Murugadoss Action/Thriller
Kabir Sadanand,Jimmy Sheirgill,Mohit Marwah,Kiara Advani,Comedy/Drama,fugly,Jimmy Sheirgill Mohit Marwah Kiara Advani Kabir Sadanand Comedy/Drama
Debaloy Dey,Bhanu Uday,Swara Bhaskar,Murali Sharma,Horror,machhli jal ki rani hai,Bhanu Uday Swara Bhaskar Murali Sharma Debaloy Dey Horror
Sajid Khan,Saif Ali Khan,Esha Gupta,Riteish Deshmukh,Comedy/Drama/Romance,humshakals,Saif Ali Khan Esha Gupta Riteish Deshmukh Sajid Khan Comedy/Drama/Romance
Mohit Suri,Sidharth Malhotra,Riteish Deshmukh,Shraddha Kapoor,Romance/Thriller,ek villain,Sidharth Malhotra Riteish Deshmukh Shraddha Kapoor Mohit Suri Romance/Thriller
Samar Shaikh,Vidya Balan,Ali Fazal,Arjan Bajwa,Comedy/Drama,bobby jasoos,Vidya Balan Ali Fazal Arjan Bajwa Samar Shaikh Comedy/Drama
Arif Ali,Armaan Jain,Deeksha Seth,Nikita Dutta,Romance/Comedy,lekar hum deewana dil,Armaan Jain Deeksha Seth Nikita Dutta Arif Ali Romance/Comedy
Shashank Khaitan,Varun Dhawan,Alia Bhatt,Sidharth Shukla,Romance/Comedy,humpty sharma ki dulhania,Varun Dhawan Alia Bhatt Sidharth Shukla Shashank Khaitan Romance/Comedy
Vishal Pandya,Surveen Chawla,Sushant Singh,Jay Bhanushali,Thriller,hate story 2,Surveen Chawla Sushant Singh Jay Bhanushali Vishal Pandya Thriller
Ajay Mehra,Om Puri,Reshmi Ghosh,Yashpal Sharma,Drama,bazaar-e-husn,Om Puri Reshmi Ghosh Yashpal Sharma Ajay Mehra Drama
Ashok Tyagi,Rajesh Khanna,Aryaman Ramsay,Aryan Vaid,Drama/Action,riyasat,Rajesh Khanna Aryaman Ramsay Aryan Vaid Ashok Tyagi Drama/Action
Ajay Bhuyan,Vir Das,Vega Tamotia,Anindita Nayar,Romance/Comedy,amit sahni ki list,Vir Das Vega Tamotia Anindita Nayar Ajay Bhuyan Romance/Comedy
Akshay Akkineni,Akshay Oberoi,Parvathy Omanakuttan,Dipannita Sharma,Horror,pizza,Akshay Oberoi Parvathy Omanakuttan Dipannita Sharma Akshay Akkineni Horror
Sajid Nadiadwala,Salman Khan,Jacqueline Fernandez,Nawazuddin Siddiqui,Action/Comedy,kick,Salman Khan Jacqueline Fernandez Nawazuddin Siddiqui Sajid Nadiadwala Action/Comedy
Sajid-Farhad,Akshay Kumar,Tamannaah Bhatia,Prakash Raj,Comedy,entertainment,Akshay Kumar Tamannaah Bhatia Prakash Raj Sajid-Farhad Comedy
Rohit Shetty,Ajay Devgn,Kareena Kapoor,Amol Gupte,Action,singham returns,Ajay Devgn Kareena Kapoor Amol Gupte Rohit Shetty Action
Manoj Amarnani,Manoj Amarnani,Anokhi Dalvi,Nancy Brunetta,Romance,life is beautiful!,Manoj Amarnani Anokhi Dalvi Nancy Brunetta Manoj Amarnani Romance
Saahil Prem,Saahil Prem,Amrit Maghera,unknown,Dance,mad about dance,Saahil Prem Amrit Maghera unknown Saahil Prem Dance
Pradeep Sarkar,Rani Mukerji,Tahir Raj Bhasin,Jisshu Sengupta,Drama/Action,mardaani,Rani Mukerji Tahir Raj Bhasin Jisshu Sengupta Pradeep Sarkar Drama/Action
Atlanta Nagendra,Rafiq Batcha,Srinivas,Dick Mays,Comedy,mumbhai connection,Rafiq Batcha Srinivas Dick Mays Atlanta Nagendra Comedy
Kunal Deshmukh,Emraan Hashmi,Humaima Malick,Paresh Rawal,Thriller,raja natwarlal,Emraan Hashmi Humaima Malick Paresh Rawal Kunal Deshmukh Thriller
Omung Kumar,Priyanka Chopra,Minakkshi Kalitaa,Zachary Coffin,Drama,mary kom,Priyanka Chopra Minakkshi Kalitaa Zachary Coffin Omung Kumar Drama
Vikram Bhatt,Bipasha Basu,Imran Abbas,unknown,Horror,creature,Bipasha Basu Imran Abbas unknown Vikram Bhatt Horror
Homi Adajania,Naseeruddin Shah,Dimple Kapadia,Pankaj Kapur,Comedy/Drama,finding fanny,Naseeruddin Shah Dimple Kapadia Pankaj Kapur Homi Adajania Comedy/Drama
Habib Faisal,Aditya Roy Kapur,Parineeti Chopra,Anupam Kher,Comedy/Drama,daawat-e-ishq,Aditya Roy Kapur Parineeti Chopra Anupam Kher Habib Faisal Comedy/Drama
Shashanka Ghosh,Sonam Kapoor,Fawad Khan,Kiron Kher,Romance/Comedy,khoobsurat,Sonam Kapoor Fawad Khan Kiron Kher Shashanka Ghosh Romance/Comedy
Vishal Mahadkar,Rannvijay Singh,Anindita Nayar,Salil Acharya,Horror,3 a.m.,Rannvijay Singh Anindita Nayar Salil Acharya Vishal Mahadkar Horror
Manish Harishankar,Soha Ali Khan,Seema Biswas,Zakir Hussain,Thriller,chaarfutiya chhokare,Soha Ali Khan Seema Biswas Zakir Hussain Manish Harishankar Thriller
Anand Kumar,Suniel Shetty,Akhil Kapur,Jay Bhanushali,Drama/Action,desi kattey,Suniel Shetty Akhil Kapur Jay Bhanushali Anand Kumar Drama/Action
Abhishek Bindal,Raghuvir Yadav,Puru Chibber,Reecha Sinha,Social satire,meinu ek ladki chaahiye,Raghuvir Yadav Puru Chibber Reecha Sinha Abhishek Bindal Social satire
Sunil Agnihotri,Mika Singh,Shaan,Gabriela Bertante,Comedy,balwinder singh famous ho gaya,Mika Singh Shaan Gabriela Bertante Sunil Agnihotri Comedy
Siddharth Anand,Hrithik Roshan,Katrina Kaif,Javed Jaffrey,Action/Romance,bang bang!,Hrithik Roshan Katrina Kaif Javed Jaffrey Siddharth Anand Action/Romance
Vishal Bhardwaj,Tabu,Shahid Kapoor,Shraddha Kapoor,Drama,haider,Tabu Shahid Kapoor Shraddha Kapoor Vishal Bhardwaj Drama
V. K. Singh,Rajniesh Duggal,Shubhashree Ganguly,Mansha Bahl,Drama,spark,Rajniesh Duggal Shubhashree Ganguly Mansha Bahl V. K. Singh Drama
Raj Purohit,Harshvardhan Deo,Cherry Mardia,Virendra Saxena,Romance,jigariyaa,Harshvardhan Deo Cherry Mardia Virendra Saxena Raj Purohit Romance
Ravindra Gautam,Anupam Kher,Neha Dhupia,Divyendu Sharma,Political Satire,ekkees toppon ki salaami,Anupam Kher Neha Dhupia Divyendu Sharma Ravindra Gautam Political Satire
Navneet Behal,Nikhil Dwivedi,Richa Chadda,unknown,Crime/Romance,tamanchey,Nikhil Dwivedi Richa Chadda unknown Navneet Behal Crime/Romance
Hemant Madhukar,Veena Malik,Karanvir Bohra,Vedita Pratap Singh,Horror,mumbai 125 km,Veena Malik Karanvir Bohra Vedita Pratap Singh Hemant Madhukar Horror
Charudutt Acharya,Rhea Chakraborty,Ali Fazal,Raghav Juyal,Comedy/Drama,sonali cable,Rhea Chakraborty Ali Fazal Raghav Juyal Charudutt Acharya Comedy/Drama
Farah Khan,Shah Rukh Khan,Deepika Padukone,Abhishek Bachchan,Action/Comedy,happy new year,Shah Rukh Khan Deepika Padukone Abhishek Bachchan Farah Khan Action/Comedy
Sabal Singh Sheikhawat,Rahul Khanna,Monica Dogra,Arjun Mathur,Drama,fireflies,Rahul Khanna Monica Dogra Arjun Mathur Sabal Singh Sheikhawat Drama
Kamal Sadanah,Abhinav Shukla,Varinder Singh Ghuman,Himarsha Venkatsamy,Drama/Action,roar: tigers of the sundarbans,Abhinav Shukla Varinder Singh Ghuman Himarsha Venkatsamy Kamal Sadanah Drama/Action
Indra Kumar,Rekha,Sharman Joshi,Randhir Kapoor,Drama,super nani,Rekha Sharman Joshi Randhir Kapoor Indra Kumar Drama
Ketan Mehta,Randeep Hooda,Nandana Sen,Paresh Rawal,Drama,rang rasiya,Randeep Hooda Nandana Sen Paresh Rawal Ketan Mehta Drama
Sarovar Banka,Shabana Azmi,Adam Laupus,Lethia Nall,Drama,a decent arrangement,Shabana Azmi Adam Laupus Lethia Nall Sarovar Banka Drama
Abhishek Sharma,Akshay Kumar,Anupam Kher,Annu Kapoor,Comedy,the shaukeens,Akshay Kumar Anupam Kher Annu Kapoor Abhishek Sharma Comedy
Bharat Jain,Prashanth Gupta,Niharica Raizada,Ashruth Jain,Found footage / Horror,6 – 5 = 2,Prashanth Gupta Niharica Raizada Ashruth Jain Bharat Jain Found footage / Horror
Shaad Ali,Ranveer Singh,Parineeti Chopra,Ali Zafar,Romance/Drama,kill dil,Ranveer Singh Parineeti Chopra Ali Zafar Shaad Ali Romance/Drama
Kabir Sadanand,Vir Das,Kunaal Roy Kapur,Shobhit Rana,Comedy,gollu aur pappu,Vir Das Kunaal Roy Kapur Shobhit Rana Kabir Sadanand Comedy
Raj Nidimoru and Krishna DK,Saif Ali Khan,Ileana D'Cruz,Govinda,Romance/Comedy,happy ending,Saif Ali Khan Ileana D'Cruz Govinda Raj Nidimoru and Krishna DK Romance/Comedy
Amit Vats,Nishant Dahiya,Pragya Jaiswal,Abhishek Kumar,Romance/Comedy,titoo mba,Nishant Dahiya Pragya Jaiswal Abhishek Kumar Amit Vats Romance/Comedy
Ajit Sinha,Shreyas Talpade,Manjari Fadnis,Hemant Pandey,Drama,wah taj,Shreyas Talpade Manjari Fadnis Hemant Pandey Ajit Sinha Drama
Rajeshwar Chauhan,Heena Panchal,Mausam Sharma,Pranshu Kaushal,Comedy,hum hai teen khurafaati,Heena Panchal Mausam Sharma Pranshu Kaushal Rajeshwar Chauhan Comedy
Rensil D'Silva,Emraan Hashmi,Randeep Hooda,Kangana Ranaut,Drama,ungli,Emraan Hashmi Randeep Hooda Kangana Ranaut Rensil D'Silva Drama
Chandraprakash Dwivedi,Adil Hussain,Mona Singh,Mukesh Tiwari,Drama,zed plus,Adil Hussain Mona Singh Mukesh Tiwari Chandraprakash Dwivedi Drama
Vivek Agnihotri,Karanvir Sharma,Mannara Chopra,Shraddha Das,Erotica/Thriller,zid,Karanvir Sharma Mannara Chopra Shraddha Das Vivek Agnihotri Erotica/Thriller
Prabhu Deva,Ajay Devgn,Sonakshi Sinha,Yami Gautam,Comedy/Action,action jackson,Ajay Devgn Sonakshi Sinha Yami Gautam Prabhu Deva Comedy/Action
Ravi Kumar,Martin Sheen,Mischa Barton,Rajpal Yadav,Drama,bhopal: a prayer for rain,Martin Sheen Mischa Barton Rajpal Yadav Ravi Kumar Drama
Satish Rajwade,Shiv Panditt,Piaa Bajpai,unknown,Drama,mumbai delhi mumbai,Shiv Panditt Piaa Bajpai unknown Satish Rajwade Drama
Amit Masurkar,Naveen Kasturia,Mayank Tewari,Aditi Vasudev,Social/Drama,sulemani keeda,Naveen Kasturia Mayank Tewari Aditi Vasudev Amit Masurkar Social/Drama
Shailesh Verma,Shashank Udapurkar,Annu Kapoor,Anupam Maanav,Sports,badlapur boys,Shashank Udapurkar Annu Kapoor Anupam Maanav Shailesh Verma Sports
Dinesh Soni,Shyam Avtar Kedia,unknown,unknown,Drama/Romance,life mein twist hai,Shyam Avtar Kedia unknown unknown Dinesh Soni Drama/Romance
Ajay Yadav,Saurabbh Roy,Arijita Roy,Meghna Patel,Drama,luv...phir kabhie,Saurabbh Roy Arijita Roy Meghna Patel Ajay Yadav Drama
Adeeb Rais,Varun Khandelwal,Danny Saru,Shenaz Treasuryvala,Comedy/Romance,main aur mr. riight,Varun Khandelwal Danny Saru Shenaz Treasuryvala Adeeb Rais Comedy/Romance
Amit Khan,Makrand Deshpande,Sanjay Mishra,Rajesh Khattar,Comedy,objection my god,Makrand Deshpande Sanjay Mishra Rajesh Khattar Amit Khan Comedy
Faizal Khan,Atif Jamil,Ibra Khan,Roselyn Dsouza,Suspense/Thriller,room – the mystery,Atif Jamil Ibra Khan Roselyn Dsouza Faizal Khan Suspense/Thriller
Rajkumar Hirani,Aamir Khan,Anushka Sharma,Sushant Singh Rajput,Comedy/Drama,pk,Aamir Khan Anushka Sharma Sushant Singh Rajput Rajkumar Hirani Comedy/Drama
Anurag Kashyap,Abir Goswami,Girish Kulkarni,Madhavi Singh,Thriller,ugly,Abir Goswami Girish Kulkarni Madhavi Singh Anurag Kashyap Thriller
